Name,Address,Phone,Contact(s)
"GOLDEN, MADELYN (Status: Waitlisted)",212 TIPTON ST   CHURCH HILL  TN  37642,(C)  (423) 429-4106,"Primary Adult: GOLDEN, ASHLEY"
"GOODMAN, ADDALYN-SEDNA (Status: Drop/Wait)",116 OAK STREET   SURGOINSVILLE  TN  37873,(C)  (423) 327-5337,"Primary Adult: TAYLOR, AMBER"
"Haun, Kinley (Status: Waitlisted)",154 Heritage Dr.   Rogersville  TN  37857,(C)  (423) 923-4332,"Primary Adult: Haun, Erica And Secondary Adult: Haun, Mikky"
"Hunter, Adrianna (Status: Waitlisted)",153 Hoard LN  Lot # 29 Church Hill  TN  37642,(C)  (276) 690-4263,"Primary Adult: Smith, Jannet And Secondary Adult: Smith, Devin"
"Lavoie, Oliva (Status: Waitlisted)",724 CARTERS VALLEY RD.   ROGERSVILLE  TN  37857,(C)  (423) 293-1782,"Primary Adult: MACHCINSKI, MICHAEL And Secondary Adult: MACHCINSKI, HEATHER"
Surgoinsville,3327 HWY. 11W  SURGOINSVILLE  TN  37873,(423) 345-3527,Responsible Staff: Jennifer Miller
"WILLIS, ATLEY (Status: Drop/Wait)",450 S  Amis Chapel Rd. Surg  TN  37873,(C)  (423) 863-4922,"Primary Adult: GREENE, BRENNAN"
"Witt, Nathaniel (Status: Waitlisted)",431 Kinkead Aave   CNURCH HILL  TN  37642,(C)  (423) 863-6446,"Primary Adult: Witt, Whittney And Secondary Adult: Witt, Robert"
